{
  "schema_version": "0.1.0",
  "commit_sha": "fe283cb9b4d98ab71981181ae9b1fa2dfcaf7ed4",
  "evidence_digest": "sha256:d1b7c00eff2d2d1e33d7fcf639b2e311",
  "components": [
    {
      "name": "llm.models",
      "responsibility": "Provider-agnostic domain model: Prompt, Conversation, Response, Tool/Toolbox and tool-call chaining that every model plugin implements.",
      "roles": [
        "domain-model",
        "generation"
      ],
      "status": "INFERRED",
      "confidence": 0.8,
      "evidence_ids": [
        "EV-0042"
      ],
      "files_read": [
        "llm/models.py"
      ],
      "inputs": [
        "prompt text, attachments, tools"
      ],
      "outputs": [
        "Response objects, tool calls"
      ]
    },
    {
      "name": "llm (root modules)",
      "responsibility": "Plugin host: a pluggy PluginManager loads default plugins and setuptools entry points in group 'llm' and exposes hook specs for models, commands, tools and template loaders.",
      "roles": [
        "plugin-host",
        "configuration"
      ],
      "status": "INFERRED",
      "confidence": 0.85,
      "evidence_ids": [
        "EV-0044",
        "EV-0036",
        "EV-0034"
      ],
      "files_read": [
        "llm/plugins.py",
        "llm/hookspecs.py"
      ]
    },
    {
      "name": "llm.default_plugins",
      "responsibility": "Bundled plugin that registers OpenAI chat and embedding models through the same hooks third-party plugins use.",
      "roles": [
        "llm-provider-adapter"
      ],
      "status": "INFERRED",
      "confidence": 0.85,
      "evidence_ids": [
        "EV-0043",
        "EV-0030"
      ],
      "files_read": [
        "llm/default_plugins/openai_models.py"
      ]
    },
    {
      "name": "llm.cli",
      "responsibility": "Click command group: the user-facing CLI for prompting, chat, logs, embeddings and plugin management.",
      "roles": [
        "interface-cli"
      ],
      "status": "INFERRED",
      "confidence": 0.8,
      "evidence_ids": [
        "EV-0041",
        "EV-0025"
      ],
      "files_read": [
        "llm/cli.py"
      ]
    },
    {
      "name": "llm.logs",
      "responsibility": "LogStore wrapping a sqlite_utils database: records prompts, responses and threads.",
      "roles": [
        "persistence"
      ],
      "status": "INFERRED",
      "confidence": 0.8,
      "evidence_ids": [
        "EV-0045"
      ],
      "files_read": [
        "llm/logs.py"
      ]
    }
  ],
  "architecture_hypotheses": [
    {
      "id": "HY-01",
      "pattern_id": "plugin",
      "pattern": "plugin architecture (microkernel)",
      "claim": "Model providers are plugins: the core defines pluggy hook specs and loads providers dynamically; OpenAI support is itself a default plugin, observed loaded at runtime with no static importer.",
      "status": "SUPPORTED",
      "confidence": 0.92,
      "evidence_ids": [
        "EV-0036",
        "EV-0034",
        "EV-0030",
        "EV-0043",
        "EV-0113",
        "EV-0114",
        "EV-0115",
        "EV-0118"
      ],
      "counter_evidence_ids": [],
      "counter_evidence_notes": [
        "searched core components (llm.cli, llm.models, llm.logs) for direct openai imports: none",
        "the runtime observation covers one entry probe (llm --help) and the test suite, not all invocations"
      ],
      "how_to_falsify": "Find a static import of llm.default_plugins.openai_models from llm.cli or llm.models in dependency-graph.json, or a run where the OpenAI models load without pluggy in the call path."
    },
    {
      "id": "HY-02",
      "pattern_id": "layered",
      "pattern": "layered",
      "claim": "CLI on top of a provider-agnostic domain layer (models) on top of persistence (logs/SQLite).",
      "status": "INFERRED",
      "confidence": 0.3,
      "evidence_ids": [
        "EV-0041",
        "EV-0042",
        "EV-0045"
      ],
      "counter_evidence_ids": [
        "EV-0010",
        "EV-0039"
      ],
      "counter_evidence_notes": [
        "import-time component cycle among cli, models, logs and the root bucket: layers are not strictly ordered"
      ],
      "how_to_falsify": "Check whether llm.models depends on llm.cli at import time after splitting the root bucket."
    }
  ],
  "primitive_roles": [
    {
      "signature": "openai",
      "role": "SUPPORTING",
      "evidence_ids": [
        "EV-0030"
      ],
      "rationale": "One provider among many, loaded as a plugin; the core is provider-agnostic."
    },
    {
      "signature": "plugin-system",
      "role": "CENTRAL",
      "evidence_ids": [
        "EV-0036"
      ],
      "rationale": "pluggy is how every model, command and tool reaches the CLI."
    },
    {
      "signature": "sqlite3",
      "role": "SUPPORTING",
      "evidence_ids": [
        "EV-0031"
      ],
      "rationale": "Logs prompts/responses and stores embeddings; not on the generation path."
    }
  ],
  "ai_assessment": {
    "classification": "AI_CORE",
    "deterministic_core": [
      "plugin loading",
      "conversation bookkeeping",
      "SQLite logging"
    ],
    "evidence_ids": [
      "EV-0030",
      "EV-0042"
    ],
    "rationale": "The product's output is model responses; the concrete provider is interchangeable via plugins."
  },
  "unknowns": [
    {
      "question": "How much real-world usage goes through third-party plugins rather than the bundled OpenAI plugin?",
      "reason": "Plugins are installed separately and are not visible in this repository."
    }
  ]
}